{
  "version": 1,
  "workspace_id": "workspace-fixture",
  "case_id": "case-fixture",
  "revision_id": "revision-1",
  "hypothesis_id": "hyp-mobile-handler",
  "objective": "correction",
  "mode": "trusted_fixture",
  "policy_version": "checkout_completion_v1",
  "oracle_hash": "f61ff4b1d14d4ef3f56c3ab18417d0dc2e7d78716c84971ac45201b865a6d607",
  "metric_hash": "25e88e0d2448f070ea12b1afb686989a5f00133ff2fdcbe65f838492bcc508ca",
  "snapshot_hash": "b7b74494ec2dce465235f90dee685bc18212591b2fb13e521722d2435f927d35",
  "fixture_hash": "8d4ba030b232df17d38eb49aae5ffa4741f4e74f68fbc400b0d10bd9fef404b8",
  "environment_hash": "303c3dc6afb9be3a283de32d0b7daa55b08850b8a3c056d4ad097ac23cc5462c",
  "runner_id": "reference-kernel",
  "repeats": 3,
  "cohorts": [
    "mobile",
    "desktop"
  ],
  "actions": [
    {
      "op": "navigate",
      "path": "/"
    },
    {
      "op": "click",
      "locator": {
        "kind": "test_id",
        "value": "pay"
      }
    }
  ],
  "arms": [
    {
      "arm": "known_good",
      "origin": "http://127.0.0.1:4301",
      "build_digest": "f25e103f638abade7ec26339256abb2dacf37e11f54d2cd33e8440c9712e399d",
      "deployment_evidence_hash": "446e38e1418c331fa42760a5a6f8fff080ccca63927b97c6c21b1420276c04bc"
    },
    {
      "arm": "incident",
      "origin": "http://127.0.0.1:4302",
      "build_digest": "f5f0c60a3e8dc523943d7b27aa9250b3e420404a5a4cd1d0a206aea5b09926b3",
      "deployment_evidence_hash": "cffa81710f5ee622be13e72ed900c6b6f48aaf3bca6e9a97b7d73d88e9551cfa"
    },
    {
      "arm": "candidate",
      "origin": "http://127.0.0.1:4303",
      "build_digest": "bf7810fd581308de06ab07c934532c23fda17bbc9d39ca628bba536be7243ae0",
      "deployment_evidence_hash": "8c0e83ee15c434bf075ccde880094616689412cd76375015eb6507a99638152a"
    }
  ]
}
